{
  "capability_negotiation": [
    {
      "artifact_id": "sha256:0e89d57bdd8d8d8266394fd6d4e605986b40a35fda93187e7c0a6a0a13f7c096",
      "profile": {
        "id": "e7q.ir.circuit-basic",
        "version": "0alpha1"
      },
      "reason": null,
      "status": "SUPPORTED",
      "unsupported_capabilities": []
    },
    {
      "artifact_id": "sha256:483d8062315806664363d6d23710165d63919daebd9e6658c392da2593517bc6",
      "profile": {
        "id": "e7q.ir.circuit-basic",
        "version": "0alpha1"
      },
      "reason": null,
      "status": "SUPPORTED",
      "unsupported_capabilities": []
    },
    {
      "artifact_id": "sha256:4ecc8398f9c7ca59facb8b6f246c30c25865e5439a4f08da1503f636b9eda2ab",
      "profile": {
        "id": "e7q.ir.circuit-basic",
        "version": "0alpha1"
      },
      "reason": null,
      "status": "SUPPORTED",
      "unsupported_capabilities": []
    },
    {
      "artifact_id": "sha256:ac783a6eef3ffd6dcb5a37ee6e538419dd5c195230d3ed9cb8704a7e8464d299",
      "profile": {
        "id": "e7q.ir.circuit-basic",
        "version": "0alpha1"
      },
      "reason": null,
      "status": "SUPPORTED",
      "unsupported_capabilities": []
    },
    {
      "artifact_id": "sha256:62ac3a19c84c3d5d98ce04315b0726ae087291b2c18df036f616caeafb43f0dc",
      "profile": {
        "id": "e7q.ir.circuit-basic",
        "version": "0alpha1"
      },
      "reason": null,
      "status": "SUPPORTED",
      "unsupported_capabilities": []
    },
    {
      "artifact_id": "sha256:32d3c3aa4d709cd2328233bd144d4f2b22275a26421b67a16a09b45c2c9bc667",
      "profile": {
        "id": "e7q.ir.circuit-basic",
        "version": "0alpha1"
      },
      "reason": null,
      "status": "SUPPORTED",
      "unsupported_capabilities": []
    },
    {
      "artifact_id": "sha256:3712f6bb221e1c07f73d21b1748e5add1bb81ef3a0a03119fd4198d1f96aebf7",
      "profile": {
        "id": "e7q.ir.circuit-basic",
        "version": "0alpha1"
      },
      "reason": null,
      "status": "SUPPORTED",
      "unsupported_capabilities": []
    }
  ],
  "checks": [
    {
      "name": "graph:object",
      "passed": true
    },
    {
      "name": "graph:fields",
      "passed": true
    },
    {
      "name": "graph:unknown-fields",
      "passed": true
    },
    {
      "name": "graph:schema",
      "passed": true
    },
    {
      "name": "graph:name",
      "passed": true
    },
    {
      "name": "graph:artifacts",
      "passed": true
    },
    {
      "name": "graph:relations",
      "passed": true
    },
    {
      "name": "artifact[0]:fields",
      "passed": true
    },
    {
      "name": "artifact[0]:unknown-fields",
      "passed": true
    },
    {
      "name": "artifact[0]:schema",
      "passed": true
    },
    {
      "name": "artifact[0]:kind",
      "passed": true
    },
    {
      "name": "artifact[0]:artifact-id-format",
      "passed": true
    },
    {
      "name": "artifact[0]:artifact-id",
      "passed": true
    },
    {
      "name": "artifact[0]:profile",
      "passed": true
    },
    {
      "name": "artifact[0]:provenance",
      "passed": true
    },
    {
      "name": "artifact[0]:payload",
      "passed": true
    },
    {
      "name": "artifact[0]:limitations",
      "passed": true
    },
    {
      "name": "artifact[1]:fields",
      "passed": true
    },
    {
      "name": "artifact[1]:unknown-fields",
      "passed": true
    },
    {
      "name": "artifact[1]:schema",
      "passed": true
    },
    {
      "name": "artifact[1]:kind",
      "passed": true
    },
    {
      "name": "artifact[1]:artifact-id-format",
      "passed": true
    },
    {
      "name": "artifact[1]:artifact-id",
      "passed": true
    },
    {
      "name": "artifact[1]:profile",
      "passed": true
    },
    {
      "name": "artifact[1]:provenance",
      "passed": true
    },
    {
      "name": "artifact[1]:payload",
      "passed": true
    },
    {
      "name": "artifact[1]:limitations",
      "passed": true
    },
    {
      "name": "artifact[2]:fields",
      "passed": true
    },
    {
      "name": "artifact[2]:unknown-fields",
      "passed": true
    },
    {
      "name": "artifact[2]:schema",
      "passed": true
    },
    {
      "name": "artifact[2]:kind",
      "passed": true
    },
    {
      "name": "artifact[2]:artifact-id-format",
      "passed": true
    },
    {
      "name": "artifact[2]:artifact-id",
      "passed": true
    },
    {
      "name": "artifact[2]:profile",
      "passed": true
    },
    {
      "name": "artifact[2]:provenance",
      "passed": true
    },
    {
      "name": "artifact[2]:payload",
      "passed": true
    },
    {
      "name": "artifact[2]:limitations",
      "passed": true
    },
    {
      "name": "artifact[2]:transformation-contract",
      "passed": true
    },
    {
      "name": "artifact[3]:fields",
      "passed": true
    },
    {
      "name": "artifact[3]:unknown-fields",
      "passed": true
    },
    {
      "name": "artifact[3]:schema",
      "passed": true
    },
    {
      "name": "artifact[3]:kind",
      "passed": true
    },
    {
      "name": "artifact[3]:artifact-id-format",
      "passed": true
    },
    {
      "name": "artifact[3]:artifact-id",
      "passed": true
    },
    {
      "name": "artifact[3]:profile",
      "passed": true
    },
    {
      "name": "artifact[3]:provenance",
      "passed": true
    },
    {
      "name": "artifact[3]:payload",
      "passed": true
    },
    {
      "name": "artifact[3]:limitations",
      "passed": true
    },
    {
      "name": "artifact[4]:fields",
      "passed": true
    },
    {
      "name": "artifact[4]:unknown-fields",
      "passed": true
    },
    {
      "name": "artifact[4]:schema",
      "passed": true
    },
    {
      "name": "artifact[4]:kind",
      "passed": true
    },
    {
      "name": "artifact[4]:artifact-id-format",
      "passed": true
    },
    {
      "name": "artifact[4]:artifact-id",
      "passed": true
    },
    {
      "name": "artifact[4]:profile",
      "passed": true
    },
    {
      "name": "artifact[4]:provenance",
      "passed": true
    },
    {
      "name": "artifact[4]:payload",
      "passed": true
    },
    {
      "name": "artifact[4]:limitations",
      "passed": true
    },
    {
      "name": "artifact[5]:fields",
      "passed": true
    },
    {
      "name": "artifact[5]:unknown-fields",
      "passed": true
    },
    {
      "name": "artifact[5]:schema",
      "passed": true
    },
    {
      "name": "artifact[5]:kind",
      "passed": true
    },
    {
      "name": "artifact[5]:artifact-id-format",
      "passed": true
    },
    {
      "name": "artifact[5]:artifact-id",
      "passed": true
    },
    {
      "name": "artifact[5]:profile",
      "passed": true
    },
    {
      "name": "artifact[5]:provenance",
      "passed": true
    },
    {
      "name": "artifact[5]:payload",
      "passed": true
    },
    {
      "name": "artifact[5]:limitations",
      "passed": true
    },
    {
      "name": "artifact[6]:fields",
      "passed": true
    },
    {
      "name": "artifact[6]:unknown-fields",
      "passed": true
    },
    {
      "name": "artifact[6]:schema",
      "passed": true
    },
    {
      "name": "artifact[6]:kind",
      "passed": true
    },
    {
      "name": "artifact[6]:artifact-id-format",
      "passed": true
    },
    {
      "name": "artifact[6]:artifact-id",
      "passed": true
    },
    {
      "name": "artifact[6]:profile",
      "passed": true
    },
    {
      "name": "artifact[6]:provenance",
      "passed": true
    },
    {
      "name": "artifact[6]:payload",
      "passed": true
    },
    {
      "name": "artifact[6]:limitations",
      "passed": true
    },
    {
      "name": "artifact[6]:claim-contract",
      "passed": true
    },
    {
      "name": "relation[0]:object",
      "passed": true
    },
    {
      "name": "relation[0]:kind",
      "passed": true
    },
    {
      "name": "relation[0]:endpoints",
      "passed": true
    },
    {
      "name": "relation[0]:validation-status",
      "passed": true
    },
    {
      "name": "relation[0]:relation-id",
      "passed": true
    },
    {
      "name": "relation[0]:transformation-contract",
      "passed": true
    },
    {
      "name": "relation[1]:object",
      "passed": true
    },
    {
      "name": "relation[1]:kind",
      "passed": true
    },
    {
      "name": "relation[1]:endpoints",
      "passed": true
    },
    {
      "name": "relation[1]:validation-status",
      "passed": true
    },
    {
      "name": "relation[1]:relation-id",
      "passed": true
    },
    {
      "name": "relation[2]:object",
      "passed": true
    },
    {
      "name": "relation[2]:kind",
      "passed": true
    },
    {
      "name": "relation[2]:endpoints",
      "passed": true
    },
    {
      "name": "relation[2]:validation-status",
      "passed": true
    },
    {
      "name": "relation[2]:relation-id",
      "passed": true
    },
    {
      "name": "relation[3]:object",
      "passed": true
    },
    {
      "name": "relation[3]:kind",
      "passed": true
    },
    {
      "name": "relation[3]:endpoints",
      "passed": true
    },
    {
      "name": "relation[3]:validation-status",
      "passed": true
    },
    {
      "name": "relation[3]:relation-id",
      "passed": true
    },
    {
      "name": "relation[4]:object",
      "passed": true
    },
    {
      "name": "relation[4]:kind",
      "passed": true
    },
    {
      "name": "relation[4]:endpoints",
      "passed": true
    },
    {
      "name": "relation[4]:validation-status",
      "passed": true
    },
    {
      "name": "relation[4]:relation-id",
      "passed": true
    },
    {
      "name": "graph:graph-id",
      "passed": true
    },
    {
      "name": "graph:unique-artifact-ids",
      "passed": true
    },
    {
      "name": "graph:unique-relation-ids",
      "passed": true
    },